{
  "$schema": "http://json-schema.org/draft-07/schema#",
  "title": "AgentContract",
  "type": "object",
  "properties": {
    "agentMetadata": {
      "type": "object",
      "properties": {
        "id": {
          "type": "string",
          "description": "Unique identifier for the agent"
        },
        "name": {
          "type": "string",
          "description": "Human-readable name of the agent"
        },
        "version": {
          "type": "string",
          "pattern": "^\\d+\\.\\d+\\.\\d+$",
          "description": "Semantic version of the agent"
        },
        "capabilities": {
          "type": "array",
          "items": {
            "type": "string"
          },
          "minItems": 1,
          "description": "List of capabilities this agent provides"
        },
        "domain": {
          "type": "string",
          "description": "Domain or category this agent operates in"
        },
        "description": {
          "type": "string",
          "description": "Detailed description of agent functionality"
        },
        "author": {
          "type": "string",
          "description": "Agent author or organization"
        },
        "tags": {
          "type": "array",
          "items": {
            "type": "string"
          },
          "description": "Tags for categorization and discovery"
        }
      },
      "required": ["id", "name", "version", "capabilities"]
    },
    "role": {
      "type": "string",
      "enum": ["PROCESSOR", "GENERATOR", "VALIDATOR", "ORCHESTRATOR", "MONITOR"],
      "description": "Primary role of the agent in the system"
    },
    "endpoints": {
      "type": "object",
      "properties": {
        "health": {
          "type": "string",
          "format": "uri",
          "description": "Health check endpoint"
        },
        "execute": {
          "type": "string",
          "format": "uri",
          "description": "Main execution endpoint"
        },
        "status": {
          "type": "string",
          "format": "uri",
          "description": "Status information endpoint"
        },
        "metrics": {
          "type": "string",
          "format": "uri",
          "description": "Metrics and performance data endpoint"
        }
      },
      "description": "API endpoints exposed by the agent"
    },
    "configuration": {
      "type": "object",
      "description": "Agent-specific configuration parameters"
    },
    "requirements": {
      "type": "object",
      "properties": {
        "memory": {
          "type": "string",
          "description": "Memory requirements (e.g., '512MB', '2GB')"
        },
        "cpu": {
          "type": "string",
          "description": "CPU requirements"
        },
        "dependencies": {
          "type": "array",
          "items": {
            "type": "string"
          },
          "description": "External dependencies required"
        }
      },
      "description": "Resource and dependency requirements"
    },
    "security": {
      "type": "object",
      "properties": {
        "permissions": {
          "type": "array",
          "items": {
            "type": "string"
          },
          "description": "Required permissions"
        },
        "authentication": {
          "type": "string",
          "enum": ["none", "api-key", "oauth", "certificate"],
          "description": "Authentication method"
        }
      },
      "description": "Security configuration"
    }
  },
  "required": ["agentMetadata", "role"],
  "roleSpecificContracts": {
    "PROCESSOR": {
      "properties": {
        "agentMetadata": {
          "properties": {
            "capabilities": {
              "contains": {
                "const": "data-processing"
              }
            }
          }
        },
        "configuration": {
          "properties": {
            "inputFormats": {
              "type": "array",
              "items": {
                "type": "string"
              }
            },
            "outputFormats": {
              "type": "array",
              "items": {
                "type": "string"
              }
            }
          }
        }
      }
    },
    "GENERATOR": {
      "properties": {
        "agentMetadata": {
          "properties": {
            "capabilities": {
              "contains": {
                "const": "content-generation"
              }
            }
          }
        },
        "configuration": {
          "properties": {
            "generationTypes": {
              "type": "array",
              "items": {
                "type": "string"
              }
            },
            "maxOutputSize": {
              "type": "integer"
            }
          }
        }
      }
    },
    "VALIDATOR": {
      "properties": {
        "agentMetadata": {
          "properties": {
            "capabilities": {
              "contains": {
                "const": "validation"
              }
            }
          }
        },
        "configuration": {
          "properties": {
            "validationRules": {
              "type": "array",
              "items": {
                "type": "object"
              }
            }
          }
        }
      }
    },
    "ORCHESTRATOR": {
      "properties": {
        "agentMetadata": {
          "properties": {
            "capabilities": {
              "contains": {
                "const": "orchestration"
              }
            }
          }
        },
        "configuration": {
          "properties": {
            "maxConcurrentTasks": {
              "type": "integer"
            },
            "taskTimeout": {
              "type": "integer"
            }
          }
        }
      }
    },
    "MONITOR": {
      "properties": {
        "agentMetadata": {
          "properties": {
            "capabilities": {
              "contains": {
                "const": "monitoring"
              }
            }
          }
        },
        "configuration": {
          "properties": {
            "monitoringInterval": {
              "type": "integer"
            },
            "alertThresholds": {
              "type": "object"
            }
          }
        }
      }
    }
  }
}

